[
  {
    "source_candidate_id": "source-candidate:barut_trakya_memorial_2024",
    "anchor_entity_id": "person:asim_orhan_barut",
    "anchor_name": "Asım Orhan Barut",
    "title": "Prof. Dr. Asım Orhan Barut’un 30. Ölüm Yılı Anma Töreni",
    "publisher": "Trakya Üniversitesi Fizik Bölümü",
    "canonical_url": "https://fizik.trakya.edu.tr/news/prof--dr--asim-orhan-barut--un-30--olum-yili-anma-toreni",
    "source_type": "html",
    "authority_level": "institutional_record",
    "access_status": "intermittent",
    "access_checked_at": "2026-07-20",
    "rights_status": "rights_review_required",
    "rights_url": null,
    "ingestion_status": "metadata_only",
    "evidence_claims": 0,
    "relationship_claims": 0,
    "research_question": "What source-locatable evidence documents Barut’s role, if any, in the Trakya research center and its establishment?",
    "note": "Institution-managed lead. The page was indexed but intermittently unavailable during the access check; no page text was imported."
  },
  {
    "source_candidate_id": "source-candidate:eryurt_tubitak_profile_2024",
    "anchor_entity_id": "person:dilhan_eryurt",
    "anchor_name": "Dilhan Eryurt",
    "title": "Dilhan Eryurt",
    "publisher": "TÜBİTAK Bilim ve Teknik",
    "canonical_url": "https://bilimteknik.tubitak.gov.tr/dilhan-eryurt-1/",
    "source_type": "html",
    "authority_level": "institutional_record",
    "access_status": "public_confirmed",
    "access_checked_at": "2026-07-20",
    "rights_status": "republication_restricted",
    "rights_url": "https://bilimteknik.tubitak.gov.tr/kullanim-sozlesmesi/",
    "ingestion_status": "metadata_only",
    "evidence_claims": 0,
    "relationship_claims": 0,
    "research_question": "Which records support Eryurt’s institutional presence at ODTÜ, NASA, and TÜBİTAK?",
    "note": "Public institutional page; TÜBİTAK’s site terms prohibit copying or redistribution without permission, so the record remains link-only."
  },
  {
    "source_candidate_id": "source-candidate:inonu_metu_memory_profile",
    "anchor_entity_id": "person:erdal_inonu",
    "anchor_name": "Erdal İnönü",
    "title": "Erdal İnönü",
    "publisher": "ODTÜ Library Digital Collection",
    "canonical_url": "https://bellek.metu.edu.tr/handle/11511/109845",
    "source_type": "html",
    "authority_level": "institutional_record",
    "access_status": "public_confirmed",
    "access_checked_at": "2026-07-20",
    "rights_status": "all_rights_reserved",
    "rights_url": "https://bellek.metu.edu.tr/handle/11511/109845",
    "ingestion_status": "metadata_only",
    "evidence_claims": 0,
    "relationship_claims": 0,
    "research_question": "Which records document İnönü’s roles at ODTÜ and the timing of those roles?",
    "note": "Public institution-managed biography with an all-rights-reserved notice; no page text was imported."
  },
  {
    "source_candidate_id": "source-candidate:ikeda_life_devoted_2003",
    "anchor_entity_id": "person:masatoshi_gunduz_ikeda",
    "anchor_name": "Masatoshi Gündüz İkeda",
    "title": "Professor Masatoshi Gündüz Ikeda: A Life Devoted to Mathematics",
    "publisher": "TÜBİTAK Turkish Journal of Mathematics",
    "canonical_url": "https://journals.tubitak.gov.tr/math/vol27/iss4/1/",
    "source_type": "pdf",
    "authority_level": "publisher_record",
    "access_status": "public_landing",
    "access_checked_at": "2026-07-20",
    "rights_status": "cc_by_4_0",
    "rights_url": "https://journals.tubitak.gov.tr/math/openaccess.html",
    "ingestion_status": "license_ready_download_pending",
    "evidence_claims": 0,
    "relationship_claims": 0,
    "research_question": "Which passages document İkeda’s academic environment, collaborators, and institutional presence among registered entities?",
    "note": "Publisher metadata and journal reuse terms are confirmed. The PDF bytes must still be acquired, hashed, and inspected before evidence extraction."
  }
]
